{
  "$schema": "https://json-schema.org/draft/2020-12/schema",
  "$id": "https://w3id.org/plato/schemas/attestation-centric.schema.json",
  "title": "PLATO Attestation-Centric Profile",
  "description": "A document of one or more attestations about SpatialEntities that already exist elsewhere, referred to by URI: the shape for adding evidence about other datasets' places without redefining them. Each attestation gives its 'about' field, except a meta-attestation, which is about the attestation it comments on.",
  "type": "object",
  "properties": {
    "$schema": {
      "type": "string",
      "const": "https://w3id.org/plato/schemas/attestation-centric.schema.json"
    },
    "@context": {
      "description": "The JSON-LD context, so that a JSON-LD processor reads the document as RDF in the PLATO ontology: https://w3id.org/plato/schemas/plato.context.jsonld, or a list or object that includes it. Optional: a tool that knows PLATO applies the context whether or not the document names it.",
      "anyOf": [
        { "type": "string", "format": "uri" },
        { "type": "object" },
        { "type": "array", "items": { "anyOf": [{ "type": "string", "format": "uri" }, { "type": "object" }] } }
      ]
    },
    "profile": {
      "type": "string",
      "const": "attestation-centric",
      "description": "Identifies this as an attestation-centric document."
    },
    "gazetteer": {
      "type": "object",
      "description": "Metadata about the contributing gazetteer.",
      "properties": {
        "@id": {
          "$ref": "plato.schema.json#/$defs/uri",
          "description": "URI of the gazetteer. In attestation-centric mode, this should typically reference an existing gazetteer."
        },
        "title": {
          "type": "string",
          "description": "Gazetteer title."
        },
        "description": {
          "type": "string"
        },
        "contributor": {
          "type": "string",
          "description": "Contributor name or URI."
        },
        "creator": {
          "type": "array",
          "minItems": 1,
          "description": "The people or organisations to cite as the dataset's authors (dcterms:creator), each with a web address such as an ORCID, a name, or both. Not the same as contributor, the gazetteer's owner.",
          "items": {
            "type": "object",
            "properties": {
              "@id": {
                "$ref": "plato.schema.json#/$defs/uri",
                "description": "A persistent address for the person or organisation: an ORCID, a ROR."
              },
              "name": {
                "type": "string",
                "description": "Their name (foaf:name)."
              }
            },
            "anyOf": [
              {
                "required": [
                  "@id"
                ]
              },
              {
                "required": [
                  "name"
                ]
              }
            ],
            "additionalProperties": false
          }
        },
        "licence": {
          "$ref": "plato.schema.json#/$defs/uri",
          "description": "The web address of the dataset's licence (dcterms:license), such as https://creativecommons.org/licenses/by/4.0/. Required once status is 'published'."
        },
        "version": {
          "type": "string",
          "description": "The gazetteer's version indicator (dcat:version): '2026-09', '1.4'. A place is cited as its IRI plus this version."
        },
        "status": {
          "type": "string",
          "enum": [
            "draft",
            "published"
          ],
          "description": "Publication status (plato:gazetteer_status). Once 'published', the gazetteer's attestations are append-only: never deleted or changed, only superseded or retracted by new ones."
        },
        "isVersionOf": {
          "$ref": "plato.schema.json#/$defs/uri",
          "description": "For a frozen snapshot: the living gazetteer it is a version of (dcat:isVersionOf)."
        },
        "previousVersion": {
          "$ref": "plato.schema.json#/$defs/uri",
          "description": "For a frozen snapshot: the snapshot before it (dcat:previousVersion)."
        },
        "keywords": {
          "type": "array",
          "items": {
            "type": "string"
          },
          "description": "Words a catalogue can find the dataset by (dcat:keyword)."
        },
        "spatial": {
          "type": "array",
          "items": {
            "$ref": "plato.schema.json#/$defs/uri"
          },
          "description": "The area the dataset covers, as web addresses (dcterms:spatial): a Wikidata or GeoNames region."
        },
        "temporal": {
          "type": "object",
          "description": "The years the dataset covers (dcterms:temporal, a dcterms:PeriodOfTime).",
          "properties": {
            "startDate": {
              "$ref": "plato.schema.json#/$defs/isoOrYear",
              "description": "The earliest date covered (dcat:startDate)."
            },
            "endDate": {
              "$ref": "plato.schema.json#/$defs/isoOrYear",
              "description": "The latest date covered (dcat:endDate)."
            }
          },
          "additionalProperties": false
        },
        "landingPage": {
          "$ref": "plato.schema.json#/$defs/uri",
          "description": "The web page where people find and download the dataset (dcat:landingPage)."
        },
        "uriSpace": {
          "type": "string",
          "format": "uri",
          "description": "The base from which the dataset's places, sources and other entities have their web addresses (void:uriSpace), e.g. https://w3id.org/whg-epns/. Choose one you control and will keep."
        }
      },
      "required": [
        "title"
      ],
      "additionalProperties": false,
      "allOf": [
        {
          "if": {
            "properties": {
              "status": {
                "const": "published"
              }
            },
            "required": [
              "status"
            ]
          },
          "then": {
            "required": [
              "licence"
            ]
          }
        }
      ]
    },
    "dataSets": {
      "type": "array",
      "description": "The statistical tables the document's figures belong to.",
      "items": {
        "$ref": "plato.schema.json#/$defs/dataSet"
      }
    },
    "relationTypes": {
      "type": "array",
      "description": "Relation types the document declares for its own use, each with the PLATO type it narrows.",
      "items": {
        "$ref": "plato.schema.json#/$defs/relationType"
      }
    },
    "attestations": {
      "type": "array",
      "description": "Attestations referencing existing SpatialEntities.",
      "items": {
        "allOf": [
          {
            "$ref": "plato.schema.json#/$defs/attestation"
          },
          {
            "type": "object",
            "description": "In attestation-centric mode, 'about' is required, identifying the existing SpatialEntity being attested, except on a meta-attestation (one with 'meta'), which is about its target attestation.",
            "anyOf": [
              {
                "required": [
                  "about"
                ]
              },
              {
                "required": [
                  "meta"
                ]
              }
            ]
          }
        ]
      },
      "minItems": 1
    },
    "newSpatialEntities": {
      "type": "array",
      "description": "Optional: new SpatialEntities that do not yet exist elsewhere. Use sparingly — only when no existing SpatialEntity matches. These follow the place-centric pattern (SpatialEntity with nested attestations) within an attestation-centric document.",
      "items": {
        "allOf": [
          {
            "$ref": "plato.schema.json#/$defs/spatialEntity"
          },
          {
            "type": "object",
            "required": [
              "attestations"
            ]
          }
        ]
      }
    },
    "identityRelations": {
      "type": "array",
      "description": "Identity assertions between SpatialEntities.",
      "items": {
        "allOf": [
          {
            "$ref": "plato.schema.json#/$defs/identityRelation"
          },
          {
            "type": "object",
            "description": "At the top level nothing supplies the subject, so it must be given.",
            "required": [
              "subject"
            ]
          }
        ]
      }
    }
  },
  "required": [
    "profile",
    "attestations"
  ],
  "additionalProperties": false
}
