{
  "$schema": "https://w3id.org/plato/schemas/attestation-centric.schema.json",
  "profile": "attestation-centric",

  "gazetteer": {
    "@id": "http://whgazetteer.org/gazetteer/678",
    "title": "London Customs Accounts 1480–1485",
    "contributor": "https://orcid.org/0000-0002-1825-0097",
    "creator": [{"@id": "https://orcid.org/0000-0003-3060-0181", "name": "Stephen Gadd"}],
    "licence": "https://creativecommons.org/licenses/by/4.0/"
  },

  "attestations": [
    {
      "about": "https://www.geonames.org/2654675/",
      "names": [
        {
          "toponym": "Bristowe",
          "language": "enm",
          "script": "Latn",
          "nameType": ["toponym"]
        }
      ],
      "timespans": [
        {
          "startEarliest": "1480",
          "startLatest": "1480",
          "endEarliest": "1485",
          "endLatest": "1485",
          "label": "Account period 1480-1485",
          "startPrecision": "year",
          "endPrecision": "year"
        }
      ],
      "types": [
        { "identifier": "http://vocab.getty.edu/aat/300008347", "label": "inhabited place" },
        { "identifier": "http://vocab.getty.edu/aat/300000745", "label": "port" }
      ],
      "sources": [
        {
          "title": "TNA E 122/19/10",
          "citation": "The National Archives, Exchequer: King's Remembrancer, E 122/19/10",
          "uri": "https://discovery.nationalarchives.gov.uk/details/r/C5846832"
        }
      ],
      "certainty": 0.95,
      "certaintyNote": "Clear manuscript hand; place identification confirmed by commodity context.",
      "contributor": "https://orcid.org/0000-0002-1825-0097",
      "created": "2026-02-16T14:00:00Z"
    },

    {
      "about": "https://whgazetteer.org/place/99001",
      "names": [
        {
          "toponym": "Deptford Strand",
          "language": "en",
          "script": "Latn",
          "nameType": ["toponym", "odonym"],
          "qualification": {
            "certainty": 0.7,
            "certaintyNote": "Manuscript partially damaged; reading probable but not certain."
          }
        }
      ],
      "geometries": [
        {
          "spatialPrecision": ["uncertain"],
          "precisionKm": [0.5],
          "qualification": {
            "relativeTo": "https://www.geonames.org/2651048/",
            "relativeQualifier": "https://w3id.org/plato#Near",
            "relativeDistance": 500,
            "fuzziness": 0.6,
            "fuzzinessNote": "Strand location was not precisely bounded; refers to a general waterfront area."
          }
        }
      ],
      "timespans": [
        {
          "startEarliest": "1481",
          "startLatest": "1481",
          "label": "First mention 1481",
          "startPrecision": "year",
          "openEnd": true
        }
      ],
      "sources": [
        { "title": "TNA E 122/19/10" }
      ],
      "certainty": 0.6,
      "certaintyNote": "Location inferred from cargo descriptions and known anchorages.",
      "contributor": "https://orcid.org/0000-0002-1825-0097",
      "created": "2026-02-16T14:00:00Z"
    }
  ],

  "identityRelations": [
    {
      "subject": "https://whgazetteer.org/place/99001",
      "object": "https://www.geonames.org/2651048/",
      "identityType": "closeMatch",
      "certainty": 0.7,
      "basis": "Deptford Strand is likely a waterfront area within modern Deptford, but the historical extent is uncertain.",
      "assertedBy": "https://orcid.org/0000-0002-1825-0097",
      "assertedAt": "2026-02-16T14:00:00Z"
    }
  ]
}
